{
	"id": "example-text-loose-leaf",
	"creator": "Loose Leaf Press (placeholder)",
	"type": "text",
	"why": "Placeholder text entry, shows the excerpt card.",
	"source_url": "https://example.invalid/loose-leaf",
	"tags": ["essay", "food-writing"],
	"excerpts": [
		"The stove ran on a pilot light older than either of us, and it never once went out, not through three landlords and one very bad winter."
	],
	"verification_token": "placeholder-token-not-real",
	"_placeholder": true
}
