{
	"id": "audio-ashzone-xeno",
	"creator": "AshZone",
	"type": "audio",
	"why": "A free 3-track EDM/DnB EP built around AshZone's own webcomic. Listen on Bandcamp.",
	"source_url": "https://ashzonemusic.bandcamp.com/album/xeno",
	"tags": ["edm", "house", "drum-and-bass"],
	"thumb_url": "https://f4.bcbits.com/img/a2112082425_10.jpg",
	"verification_token": "unverified-seed-entry"
}
