{
	"id": "example-audio-driftwood-radio",
	"creator": "Driftwood Radio (placeholder)",
	"type": "audio",
	"why": "Placeholder audio entry, shows the track-tab layout with more than one track.",
	"source_url": "https://example.invalid/driftwood-radio",
	"tags": ["ambient", "lo-fi"],
	"tracks": [
		{
			"label": "Harbor Light",
			"media_url": "https://example.invalid/media/harbor-light.mp3"
		},
		{
			"label": "Static Tide",
			"media_url": "https://example.invalid/media/static-tide.mp3"
		}
	],
	"verification_token": "placeholder-token-not-real",
	"_placeholder": true
}
